[
  {
    "id": "event-2026-07-07-backrooms-pvod-reported",
    "eventDate": "2026-07-07",
    "datePrecision": "day",
    "publishedDate": "2026-07-03",
    "title": "Premium VOD debut reported for Backrooms",
    "summary": "The Associated Press reported that Backrooms makes its premium video-on-demand debut on July 7, 2026, available for purchase on major streaming services.",
    "topics": [
      "backrooms",
      "digital-release",
      "pvod"
    ],
    "people": [
      "kane-parsons"
    ],
    "organizations": [
      "a24"
    ],
    "sourceIds": [
      "source-ap-backrooms-pvod-2026-07-03"
    ],
    "status": "reported",
    "confidence": "high",
    "primarySourceAvailable": false,
    "interpretation": "This is directly relevant to U.S. viewers, but the available AP item does not establish whether the Everything Must Go post-credit footage is included in the digital purchase.",
    "editionRefs": [
      "001",
      "002"
    ],
    "lastReviewed": "2026-07-06",
    "notes": "Retailer checks on July 8 complicated the July 7 report rather than confirming a clean launch; see the follow-up disputed digital-status event."
  },
  {
    "id": "event-2026-07-08-backrooms-digital-status-disputed",
    "eventDate": "2026-07-08",
    "datePrecision": "day",
    "publishedDate": null,
    "title": "Backrooms digital availability remains unresolved after reported PVOD date",
    "summary": "After the reported July 7 premium VOD date, Prime Video still listed Backrooms as a UHD pre-order with release date coming soon, while Apple TV search displayed the title as unavailable in the U.S. storefront.",
    "topics": [
      "backrooms",
      "digital-release",
      "pvod"
    ],
    "people": [
      "kane-parsons"
    ],
    "organizations": [
      "a24",
      "prime-video",
      "apple-tv"
    ],
    "sourceIds": [
      "source-ap-backrooms-pvod-2026-07-03",
      "source-prime-video-backrooms-preorder-2026-07-08",
      "source-apple-tv-backrooms-search-2026-07-08",
      "source-decider-backrooms-digital-delay-2026-07-07"
    ],
    "status": "disputed",
    "confidence": "high",
    "primarySourceAvailable": true,
    "interpretation": "The safe claim is that the July 7 date became contested in public availability data. It should not be described as a completed PVOD launch without platform-specific proof.",
    "editionRefs": [
      "002"
    ],
    "lastReviewed": "2026-07-08",
    "notes": "Recheck storefronts before publication because digital availability can change without a press release."
  },
  {
    "id": "event-2026-07-03-everything-must-go-release",
    "eventDate": "2026-07-03",
    "datePrecision": "day",
    "publishedDate": null,
    "title": "Everything Must Go Edition opens in theaters",
    "summary": "SIFF Cinema listed Backrooms: Everything Must Go Edition opening July 3 with a 126-minute runtime and 15 minutes of new theatrically exclusive post-credit footage.",
    "topics": [
      "backrooms",
      "extended-cut",
      "release"
    ],
    "people": [
      "kane-parsons"
    ],
    "organizations": [
      "a24",
      "siff"
    ],
    "sourceIds": [
      "source-siff-everything-must-go-2026-07-03",
      "source-a24-x-everything-must-go-2026-07-03",
      "source-loft-everything-must-go-2026-07-08",
      "source-laemmle-everything-must-go-2026-07-08",
      "source-gamesradar-everything-must-go-process-2026-07-03"
    ],
    "status": "confirmed",
    "confidence": "high",
    "primarySourceAvailable": false,
    "interpretation": null,
    "editionRefs": [
      "001",
      "002"
    ],
    "lastReviewed": "2026-07-08",
    "notes": "A24 and some exhibitor listings describe 16 minutes of footage, while SIFF and Laemmle use 15 minutes. Runtime listings vary between 126 and 127 minutes. Multiple listings describe the material as theatrically exclusive post-credit footage."
  },
  {
    "id": "event-2026-06-28-japan-release-announcement",
    "eventDate": "2026-06-28",
    "datePrecision": "day",
    "publishedDate": "2026-06-28",
    "title": "September 4 Japanese release listed by A24×Happinet",
    "summary": "The official A24×Happinet Phantom Studios Japanese film page lists Backrooms for release on September 4, 2026.",
    "topics": [
      "backrooms",
      "international-release",
      "japan"
    ],
    "people": [
      "kane-parsons"
    ],
    "organizations": [
      "a24-japan",
      "happinet-phantom-studios"
    ],
    "sourceIds": [
      "source-a24-happinet-backrooms-japan-page-2026-07-06",
      "source-backroomsmovie-japan-2026-06-28"
    ],
    "status": "confirmed",
    "confidence": "high",
    "primarySourceAvailable": true,
    "interpretation": null,
    "editionRefs": [],
    "lastReviewed": "2026-07-06",
    "notes": "The community report remains useful for tracking when the announcement surfaced; the official distributor page now supplies the confirmation."
  },
  {
    "id": "event-2026-06-27-parsons-rejects-ai-use-on-backrooms",
    "eventDate": "2026-06-27",
    "datePrecision": "day",
    "publishedDate": "2026-06-27",
    "title": "Parsons reportedly rejects using partnership resources on Backrooms",
    "summary": "Kotaku reported a Discord statement in which Parsons said he was making clear that the A24/DeepMind resources were not to be spent on Backrooms.",
    "topics": [
      "backrooms",
      "ai",
      "a24"
    ],
    "people": [
      "kane-parsons"
    ],
    "organizations": [
      "a24",
      "google-deepmind"
    ],
    "sourceIds": [
      "source-kotaku-kane-ai-scope-2026-06-27"
    ],
    "status": "reported",
    "confidence": "medium",
    "primarySourceAvailable": false,
    "interpretation": "The statement concerns Parsons' intent and boundaries. It is not evidence that he controls the partnership or every future production decision.",
    "editionRefs": [
      "001"
    ],
    "lastReviewed": "2026-07-05",
    "notes": "Archive the original Discord message and surrounding conversation before treating it as primary evidence."
  },
  {
    "id": "event-2026-06-26-valve-hq-visit",
    "eventDate": "2026-06-26",
    "datePrecision": "day",
    "publishedDate": "2026-06-26",
    "title": "Valve headquarters visit becomes public",
    "summary": "GamesRadar reported that Parsons posted Instagram Story images from Valve headquarters. The visit is reportable; its purpose and any connection to a Portal adaptation remain unconfirmed.",
    "topics": [
      "portal",
      "valve",
      "signal"
    ],
    "people": [
      "kane-parsons"
    ],
    "organizations": [
      "valve"
    ],
    "sourceIds": [
      "source-gamesradar-valve-visit-2026-06-26"
    ],
    "status": "reported",
    "confidence": "medium",
    "primarySourceAvailable": false,
    "interpretation": "The visit is a meaningful signal because Parsons had already expressed exploratory interest in Portal. It is not evidence of a pitch, rights agreement, or approved film.",
    "editionRefs": [
      "001"
    ],
    "lastReviewed": "2026-07-05",
    "notes": "Accessible reporting does not establish repeated visits over a week."
  },
  {
    "id": "event-2026-06-22-a24-deepmind-partnership",
    "eventDate": "2026-06-22",
    "datePrecision": "day",
    "publishedDate": "2026-06-22",
    "title": "A24 and Google DeepMind announce research partnership",
    "summary": "Google DeepMind and A24 announced a research partnership focused on new workflows and techniques for filmmakers. No specific film was named. The approximately $75 million investment figure remains attributed reporting rather than a confirmed amount in the primary announcement.",
    "topics": [
      "a24",
      "ai",
      "industry"
    ],
    "people": [],
    "organizations": [
      "a24",
      "google-deepmind",
      "google"
    ],
    "sourceIds": [
      "source-deepmind-a24-partnership-2026-06-22",
      "source-reuters-a24-deepmind-2026-06-22",
      "source-wsj-a24-google-investment-2026-06-22"
    ],
    "status": "confirmed",
    "confidence": "high",
    "primarySourceAvailable": true,
    "interpretation": null,
    "editionRefs": [
      "001"
    ],
    "lastReviewed": "2026-07-05",
    "notes": "The partnership is confirmed. The investment amount is reported. No source reviewed establishes use on Backrooms."
  },
  {
    "id": "event-2026-06-21-backrooms-crosses-300m",
    "eventDate": "2026-06-21",
    "datePrecision": "day",
    "publishedDate": "2026-06-21",
    "title": "Backrooms passes $300 million worldwide",
    "summary": "Variety reported approximately $301 million worldwide on June 21, making Backrooms the first A24 release to exceed $300 million globally.",
    "topics": [
      "backrooms",
      "box-office",
      "a24"
    ],
    "people": [
      "kane-parsons"
    ],
    "organizations": [
      "a24"
    ],
    "sourceIds": [
      "source-variety-backrooms-300m-2026-06-21",
      "source-box-office-mojo-backrooms-2026"
    ],
    "status": "confirmed",
    "confidence": "high",
    "primarySourceAvailable": false,
    "interpretation": null,
    "editionRefs": [
      "001"
    ],
    "lastReviewed": "2026-07-05",
    "notes": "Cumulative box-office totals are dynamic; quote them with a source date."
  },
  {
    "id": "event-2026-06-05-portal-interest-reported",
    "eventDate": "2026-06-05",
    "datePrecision": "day",
    "publishedDate": "2026-06-05",
    "title": "Exploratory interest in a Portal film is publicly attributed to Parsons",
    "summary": "New York Times reporter Kyle Buchanan said he had asked Parsons in early May about directing Portal and that Parsons was already looking into it with caution and curiosity.",
    "topics": [
      "portal",
      "adaptation",
      "interview"
    ],
    "people": [
      "kane-parsons",
      "kyle-buchanan"
    ],
    "organizations": [
      "valve"
    ],
    "sourceIds": [
      "source-kyle-buchanan-portal-post-2026-06-05"
    ],
    "status": "reported",